<?xml version="1.0" encoding="UTF-8"?>
<!DOCTYPE blockem_challenge SYSTEM "blockem_challenge.dtd">

<blockem_challenge name="tmpl: Example 1">
    
    <board>

        <nrows>14</nrows>
        <ncolumns>14</ncolumns>
    </board>
  
    <opponent>
        <taken row="4"  col="4"/>
        <taken row="5"  col="5"/>
        <taken row="10" col="10"/>
    </opponent>
    
    <!-- 
        challenger is always active, "active" tag can't be used as in 
        "opponent"
        
        MISSING
    -->

</blockem_challenge>
